{
  "as_of": "2026-07-31T02:08:42.659492Z",
  "blocking_reasons": [],
  "contract_version": "0.2.0",
  "data_cutoff": "2026-07-31T02:08:42.579241Z",
  "gates": {
    "bar_semantics": "pass",
    "baseline_frozen": "pass",
    "completeness": "pass",
    "event_clock": "pass",
    "feature_snapshot_frozen": "pass",
    "instrument_available": "pass",
    "licence": "pass",
    "macro_coverage": "pass",
    "snapshot_hash": "pass",
    "temporal_integrity": "pass"
  },
  "input": {
    "baseline": "baseline-snapshot.json",
    "daily_complete_bars": 4999,
    "evidence_manifest": "evidence-manifest.json",
    "feature_snapshot": "feature-snapshot.json",
    "h4_complete_bars": 299,
    "previous_frame": null,
    "private_raw_data": true
  },
  "instrument": "XAUUSD",
  "mode": "certified",
  "outputs": {
    "delta": null,
    "evidence_items": null,
    "explanation": null,
    "forecast": null,
    "frame": null,
    "resolution": null
  },
  "provenance": {
    "created_at": "2026-07-31T02:08:42.659492Z",
    "model_versions": [
      "baseline-only:0.1.0"
    ],
    "prompt_version": "daily-cognition-run:0.2.0",
    "runtime_version": "dao-certified-runtime:0.2.0",
    "source_policy_version": "data-source-qualification:0.1.0"
  },
  "run_id": "run-20260731-xauusd",
  "status": "ready"
}
